Level;Free;EN;ES
A1;;I can use simple phrases and sentences to describe where I live and people I know. ;16
A2;;I can use a series of phrases and sentences to describe in simple terms my family and other people, living conditions, my educational background and my present or most recent job. ;17
B1;;I can connect phrases in a simple way in order to describe experiences and events, my dreams, hopes and ambitions. ;18
B1;;I can briefly give reasons and explanations for opinions and plans. ;19
B1;;I can narrate a story or relate the plot of a book or film and describe my reactions. ;20
B2;;I can present clear, detailed descriptions on a wide range of subjects related to my field of interest. ;21
B2;;I can explain a viewpoint on a topical issue giving the advantages and disadvantages of various options. ;22
C1;;I can present clear, detailed descriptions of complex subjects integrating sub-themes, developing particular points and rounding off with an appropriate conclusion. ;23
C2;;I can present a clear, smoothly-flowing description or argument in a style appropriate to the context and with an effective logical structure which helps the recipient to notice and remember significant points. ;24